<?xml version="1.0" encoding="UTF-8"?>
<autotest xmlns="http://glodon.com" xmlns:xsi="http://www.w3.org/2001/XMLSchema-instance"
	xsi:schemaLocation="http://glodon.com ../../autotest.web.framework.xsd ">
	<engine driver="firefox" timeout="30" fullScreen="false" maximize="true" />
	<!-- 首页登操作-->
	<pages pagePackage="page">
		<page class="FirstPage" url="${param.url}">
			<!-- 首页登陆点击 -->
			<field name="firstButton" byXpath="//span[text()='首页']" type="button"/>
			<!-- 手机号 -->
			<field name="telNum" byXpath="//input[@placeholder='手机号']" type="input"/>
			<!-- 验证码 -->
			<field name="VerificationCode" byXpath="//input[@placeholder='验证码']" type="input"/>
			<!-- 登录按钮 -->
			<field name="loginBtn" byXpath="//div[@id='app']/div[3]/div/div[4]" type="button"/>
			
		</page>
	</pages>
</autotest>